id,user_prompt,technique
997,Organize a home office for remote work.,cot
998,Plan a minimalist wardrobe for daily wear.,cot
999,How can literature programs at the university level foster both analytical skills and creative engagement in students?,cot
1000,Formulate guidelines for ethical use of predictive policing tools.,cot
1001,How can a museum increase visitor engagement with digital exhibits?,cot
1002,What are the best strategies for integrating ethical reasoning into business school curricula?,cot
1003,How do language barriers influence healthcare access?,cot
1004,How can universities create inclusive environments that support students with disabilities in both academic and social aspects of campus life?,cot
1005,Explain the fundamentals of effective communication.,role
1006,What are the most effective legal frameworks for protecting digital intellectual property in a globalized world?,cot
1007,What strategies can reduce digital misinformation during elections?,cot
1008,What coordinated international strategies are needed to advance the search for life beyond Earth?,cot
1009,What are the best strategies for healthy eating?,role
1010,Explore the history of artificial intelligence development.,role
1011,What contributes to language loss among indigenous communities?,cot
1012,How can workshop-based maker spaces advance STEM education equity?,role
1013,Explain the concept of supply chain logistics.,role
1014,What was the Harlem Renaissance and why is it significant to American cultural history?,role
1015,Describe strategies for urban wildlife conservation.,role
1016,How can someone boost creativity in their daily routine?,cot
1017,How can public transportation be made safer for marginalized populations?,cot
1018,Discuss the impact of stress on physical health.,role
1019,Explore the concept of global citizenship.,role
1020,Discuss the significance of the Industrial Revolution.,role
1021,Design a social media strategy for a new nonprofit.,cot
1022,How can a student improve their time management?,cot
1023,Create a marketing strategy for a local restaurant.,role
1024,How can public health campaigns be tailored to address mental health stigma in different cultural contexts?,cot
1025,Explain the concept of cognitive biases.,role
1026,Explain the concept of public health.,role
1027,How do open-source projects sustain community contributions?,cot
1028,What are the most effective ways to use behavioral science insights to encourage environmentally sustainable choices in consumers?,cot
1029,How does language learning influence cognitive development across the lifespan?,role
1030,Discuss the importance of financial literacy in today's society.,role
1031,Write a short story about a robot gaining consciousness.,role
1032,How does income inequality affect democratic participation?,cot
1033,What are effective methods for conflict resolution in community organizations?,role
1034,What are the best methods for a government to protect citizen privacy while enabling effective digital public services?,cot
1035,What techniques help improve memory and recall?,cot
1036,Discuss the implications of artificial intelligence in finance.,role
1037,How does behavioral economics explain irrational consumer decisions in digital marketplaces?,role
1038,How can mathematics curricula be reformed to better prepare students for data-driven careers?,cot
1039,How can policymakers design tax incentives to accelerate the transition to renewable energy sources?,cot
1040,How do artistic movements respond to political unrest?,cot
1041,Design a meal plan that supports fitness training.,cot
1042,Analyze the significance of the feminist movement.,role
1043,Explore the importance of disaster risk reduction planning.,role
1044,How can mathematics educators design curriculum and instruction to reduce math anxiety and foster a growth mindset in students?,cot
1045,What causes ocean acidification and how can we mitigate it?,role
1046,Create a healthy evening routine for better sleep.,cot
1047,Explore the relationship between health and nutrition.,role
1048,What steps should national education systems take to prepare students for the ethical challenges posed by artificial intelligence and automation?,cot
1049,Discuss the significance of cultural diversity in education.,role
1050,Create a YouTube channel focused on educational content.,cot
1051,How should a city integrate green infrastructure into urban planning to build resilience against climate change?,cot
1052,How do economic recessions impact higher education access?,cot
1053,What drives the spread of zoonotic diseases?,cot
1054,Explain the basics of genetic engineering.,role
1055,What are the best methods for integrating ethical debates into STEM education at the secondary level?,cot
1056,Analyze the ethical considerations of data privacy.,role
1057,How does social isolation impact physical health over time?,cot
1058,How can secondary schools improve mathematical literacy and confidence among students of diverse backgrounds?,cot
1059,How do digital recommendation algorithms influence consumer behavior?,cot
1060,What are the consequences of hospital closures in rural regions?,cot
1061,Analyze the impact of remote work on productivity.,role
1062,How can someone improve their public speaking skills?,cot
1063,Develop a system for tracking freelance work.,cot
1064,Explain the principles of effective project management.,role
1065,What policies promote equitable internet access in rural areas?,cot
1066,How do social movements maintain momentum over time?,role
1067,How do music and collective rituals reinforce cultural memory during crises?,role
1068,Explain the circular‑economy principles in manufacturing.,role
1069,Discuss the evolution of modern economics.,role
1070,What is the most effective strategy for a national government to support innovation and entrepreneurship?,cot
1071,Explain differences between major and minor musical scales to beginners.,role
1072,How can school systems ensure equitable access to STEM resources and opportunities for all students?,cot
1073,How do vaccines work to protect the body?,role
1074,What policies would most effectively reduce childhood poverty in an advanced economy?,cot
1075,How does screen time affect early childhood development?,cot
1076,Plan a multi-lingual voter education initiative for a major election.,cot
1077,What strategies can a government use to foster innovation in space exploration while ensuring international cooperation and safety?,cot
1078,Build a tracking system for grant applications.,cot
1079,Explain the significance of ethical consumerism.,role
1080,How did decolonization shape the political and economic structures of postcolonial states?,role
1081,Organize a shared calendar for a team project.,cot
1082,What was the Harlem Renaissance and why is it significant to American culture?,role
1083,How can schools promote media literacy to combat the spread of disinformation among students?,cot
1084,What are the steps to adopt a minimalist lifestyle?,cot
1085,Analyze the impact of mobile payment technology.,role
1086,Explain the concept of behavioral economics.,role
1087,Design a monthly maintenance checklist for an apartment.,cot
1088,How do philosophical theories of identity inform debates on gender and selfhood?,role
1089,How can educators foster metacognitive skills in students to enhance their independent learning?,cot
1090,Prepare a team for an upcoming product launch.,cot
1091,Propose a public awareness campaign on digital privacy.,cot
1092,What strategies should universities employ to internationalize their curriculum and foster global citizenship?,cot
1093,Analyze the ethical issues surrounding animal testing.,role
1094,Discuss the significance of emotional well-being in the workplace.,role
1095,How do international sanctions impact local economies?,cot
1096,Explore the narrative role of unreliable narrators in fiction and film.,role
1097,How can literature programs at the university level foster both analytical skills and creative engagement in students?,cot
1098,Explain the principles of effective teamwork.,role
1099,Create a plan for a community health initiative.,role
1100,Create a city-wide plan for heatwave preparedness.,cot
1101,What are the most effective ways to manage screen time for children?,cot
1102,How do financial literacy programs impact intergenerational wealth gaps?,role
1103,How can STEM outreach initiatives effectively inspire underrepresented youth to pursue careers in science and engineering?,cot
1104,Create a scenario where a mathematician must solve a real-world problem using calculus.,role
1105,Describe the function of end-to-end encryption in modern communication apps.,role
1106,What is the most effective way for governments to address the root causes of urban poverty?,cot
1107,How does climate change affect migration patterns globally?,cot
1108,How can a government modernize its cybersecurity infrastructure to protect against evolving digital threats?,cot
1109,"How could a city redesign its public transportation system to maximize accessibility, sustainability, and economic growth?",cot
1110,Design a process for evaluating open-source software for government use.,cot
1111,How can someone stay consistent with fitness goals?,cot
1112,What challenges do gig economy workers face regarding job security?,cot
1113,What steps should a country take to protect biodiversity while supporting agricultural productivity?,cot
1114,What drives the popularity of conspiracy theories online?,cot
1115,What are the key features of cloud computing?,role
1116,Analyze the role of cooperative ownership models in alleviating wealth inequality.,role
1117,Design a public arts grant system that prioritizes community engagement.,cot
1118,Explore the role of technology in education.,role
1119,How does the endocrine system regulate stress?,role
1120,What role does architecture play in promoting mental well-being?,role
1121,"What are the most promising developments in quantum computing, and how should policymakers prepare for their impact?",cot
1122,How to design inclusive playgrounds for children of all abilities?,role
1123,Explain the basics of blockchain technology.,role
1124,How could a global alliance work together to eliminate plastic pollution in the world’s oceans?,cot
1125,What is the best way to foster innovation in a team?,role
1126,What strategies support cross‑cultural business negotiations?,role
1127,What are the economic effects of inflation?,role
1128,What is the role of citizen science in modern ecological monitoring?,role
1129,What would be the best approach for a city to revitalize neglected urban neighborhoods while preventing displacement of existing residents?,cot
1130,Discuss the implications of social media on political discourse.,role
1131,What are the economic consequences of biodiversity loss?,cot
1132,Discuss the significance of oral storytelling traditions.,role
1133,What is the best way for a nation to develop a disaster-resilient power grid?,cot
1134,How can someone become more confident in social situations?,cot
1135,How do government surveillance programs affect citizen behavior?,cot
1136,Explain the ecological importance of keystone species.,role
1137,How can educators use project-based learning to enhance both content mastery and collaborative skills among students?,cot
1138,How does media coverage influence perceptions of migration?,cot
1139,Explore the concept of existentialism in philosophy.,role
1140,How can behavioral insights improve public policy outcomes?,role
1141,Write a short story about an alien visiting Earth.,role
1142,Create a travel itinerary for a cultural city trip.,cot
1143,How can someone reduce their screen time without missing important updates?,cot
1144,How can individuals prepare for a natural disaster?,role
1145,What lessons can planetary geology teach us about climate resilience on Earth?,role
1146,Explore the philosophical concept of utilitarianism.,role
1147,How can a national government ensure equitable access to digital healthcare services for all citizens?,cot
1148,How can parents encourage reading habits in children?,cot
1149,What is the function of satire in holding power to account throughout history?,role
1150,How can someone increase daily productivity?,cot
1151,How can interdisciplinary collaboration advance scientific discovery?,role
1152,Explain the concept of cultural relativism.,role
1153,How can small businesses optimize cash flow during economic downturns?,role
1154,Build a routine to support long-term creative projects.,cot
1155,Create a marketing strategy for a mobile app launch.,cot
1156,How do different education philosophies shape pedagogy?,role
1157,What challenges arise when integrating Indigenous knowledge systems into environmental governance?,role
1158,Discuss the role of probiotics in digestive health.,role
1159,Write a short story about a detective in a dystopian future.,role
1160,Organize a closet without getting overwhelmed.,cot
1161,What are the sociological implications of remote work becoming permanent?,role
1162,How can advances in neuroscience research be translated into practical interventions for improving mental health?,cot
1163,Discuss the implications of climate policy on global economics.,role
1164,What are the challenges of enforcing international environmental agreements?,cot
1165,Describe the role of women in the Industrial Revolution.,role
1166,Discuss the influence of classical music on cognitive function.,role
1167,How can primary and secondary schools integrate computational thinking into their core curricula to prepare students for a digital future?,cot
1168,What is the role of satire in digital activism?,role
1169,Explore the role of education in social mobility.,role
1170,"How can urban planners ensure equitable access to green infrastructure, such as parks and community gardens, in rapidly growing cities?",cot
1171,Discuss the implications of telemedicine.,role
1172,Describe the benefits of mindfulness practices.,role
1173,Build a basic budgeting system for monthly expenses.,cot
1174,Explore the connection between literature and social change.,role
1175,What are the privacy implications of biometric data collection?,cot
1176,What are the most effective strategies for preserving endangered world heritage sites amid political instability and climate change?,cot
1177,What is the sociopolitical impact of internet censorship in authoritarian regimes?,role
1178,How can museums and cultural institutions use digital technology to expand public engagement and education?,cot
1179,What strategies make emergency alert systems more effective?,cot
1180,How can creative writing enhance empathy and social understanding?,role
1181,What is the most effective way for nations to coordinate pandemic preparedness and response at the global level?,cot
1182,What factors influence how people perceive climate change risk?,cot
1183,Explain the impact of microplastics on marine life.,role
1184,Examine how urban planning policies can contribute to or alleviate socioeconomic segregation.,role
1185,Develop a recycling education curriculum for middle schools.,cot
1186,Discuss the relationship between art and identity.,role
1187,Redesign a workspace for hybrid collaboration.,cot
1188,Explore the role of fiction in understanding human experiences.,role
1189,What are the essential elements of a compelling personal essay for university admissions?,role
1190,Why are keystone species vital for ecosystems?,role
1191,What are the most effective ways to use behavioral science insights to encourage environmentally sustainable choices in consumers?,cot
1192,What is the most effective way to support adult learners in mastering new technologies for workforce development?,cot
1193,Explain the importance of early childhood education.,role
1194,What is the best approach for a country to preserve and promote its intangible cultural heritage?,cot
1195,How do art-based methods support interdisciplinary research in public health?,role
1196,How can philosophy education in high schools be structured to encourage independent thought and critical engagement with contemporary issues?,cot
1197,What strategies can improve civic engagement among young voters?,cot
1198,Formulate a disaster preparedness plan for a small business.,cot
1199,What makes disaster recovery efforts more equitable?,cot
1200,Create an implementation plan for universal pre-K in a mixed-income city.,cot
