id,user_prompt,technique
334,What policies are most effective for promoting biodiversity conservation in agricultural regions?,cot
335,How does blockchain technology enhance supply chain transparency?,role
336,Create a morning routine that supports long-term goals.,cot
337,How does financial technology (FinTech) reshape global banking access and regulation?,role
338,Analyze the impact of advertising on consumer behavior.,role
339,Analyze the role of women in science throughout history.,role
340,How can a healthcare system reduce disparities in health outcomes among different population groups?,cot
341,What are the economic impacts of universal basic income trials?,role
342,What drives the formation of cultural stereotypes?,cot
343,How can we make online education more engaging for students?,cot
344,Create a plan to move to a new city for work.,cot
345,Create an outreach plan for increasing STEM interest in underrepresented youth.,cot
346,Analyze the role of art in society.,role
347,Create a marketing campaign for a new health app.,role
348,How can museums and galleries decolonize their collections and narratives?,role
349,Explain how economic globalization affects labor rights in developing nations.,role
350,Build a daily gratitude practice.,cot
351,Explain the concept of relativity.,role
352,How can societies balance civil liberties with public safety in crises?,role
353,Propose a plan to transition municipal fleets to electric vehicles.,cot
354,Create a curriculum to teach high school students about digital privacy.,cot
355,How does geothermal energy work and in which regions is it most viable?,role
356,How can museums engage younger audiences in historical content?,cot
357,What are the educational benefits of multilingual classrooms?,cot
358,What approach should a city take to achieve zero waste within a decade while maintaining economic vitality?,cot
359,What are the cognitive and cultural benefits of teaching philosophy to children in early education?,role
360,Explain the mechanics of photosynthesis.,role
361,Write a persuasive op-ed for a local newspaper.,cot
362,Analyze the psychological effects of social media on adolescents.,role
363,How can wearable technology advance preventive healthcare?,cot
364,Evaluate how participatory art engages communities in social justice movements.,role
365,Outline a recovery plan after a data breach.,cot
366,How do geopolitics influence global data infrastructure and internet sovereignty?,role
367,How is 3D printing revolutionizing prosthetics?,role
368,How do interest rates affect consumer spending?,role
369,How can critical thinking skills be developed and assessed in university humanities courses?,cot
370,How does automation affect wage structures in manufacturing industries?,cot
371,What cultural dynamics drive the global spread of K-pop and Korean media?,role
372,How does geothermal energy work and where is it most viable?,role
373,What factors influence the effectiveness of environmental protests?,cot
374,How can a city implement effective flood prevention measures?,cot
375,Develop a plan to reduce screen time.,cot
376,Analyze the impact of climate change on global ecosystems.,role
377,Develop a strategy for digitizing government services in low-connectivity regions.,cot
378,Design a strategy to reduce single-use packaging in restaurant delivery services.,cot
379,What makes a public health campaign effective in changing behavior?,cot
380,Develop a framework for evaluating ethical investment portfolios.,cot
381,How can urban heat islands be mitigated in city planning?,cot
382,Explore the role of technology in enhancing productivity.,role
383,How can technology support independent living for older adults?,cot
384,How does misinformation spread during humanitarian crises?,cot
385,How can cities implement smart transportation systems to reduce congestion?,role
386,How can game theory optimize negotiation outcomes in diplomacy?,role
387,What are the best methods for integrating climate change education across subjects in K–12 schools?,cot
388,Explain Silk Road’s cultural and economic impact.,role
389,How can we design inclusive playgrounds for children of all abilities?,role
390,Design a system to manage time across multiple freelance clients.,cot
391,How can blockchain make charitable donations transparent?,role
392,What strategies help students with ADHD succeed academically?,role
393,What are the best practices for building a mobile app?,cot
394,Plan a city-wide digital literacy initiative for seniors.,cot
395,Discuss ethical considerations in organ transplantation.,role
396,Propose a traffic safety plan for a busy school zone.,cot
397,What are the most effective strategies for supporting workforce re-entry for formerly incarcerated individuals?,cot
398,Build a system to manage household responsibilities.,cot
399,What is the most effective way for employers to support the mental health of remote and hybrid workers?,cot
400,Develop a reading plan for mastering a new subject.,cot
401,Create a technical report about cybersecurity best practices.,role
402,Design a workspace that enhances focus and creativity.,cot
403,How does early exposure to music affect childhood brain development?,cot
404,Create a podcast script about artificial intelligence in daily life.,role
405,How can educational games support learning in STEM subjects?,cot
406,How should global history curricula be updated to reflect contemporary challenges and foster intercultural understanding?,cot
407,Create a business plan for a startup.,role
408,Discuss the implications of climate change.,role
409,What are the cognitive and social benefits of learning musical instruments in adolescence?,role
410,Organize digital files for long-term access.,cot
411,What psychological effects arise from social media overuse in adolescents?,cot
412,How do disaster insurance gaps affect recovery in low-income communities?,cot
413,What is the best way for governments to ensure transparency and accountability in the use of artificial intelligence for public decision-making?,cot
414,What’s an effective way to build a strong morning routine?,cot
415,How does biodiversity loss impact cultural heritage and indigenous livelihoods?,role
416,Explain the concept of intersectionality in social studies.,role
417,Draft a proposal for improving mental health services on university campuses.,cot
418,Describe the benefits of volunteering.,role
419,Develop guidelines for ethical AI use in education.,cot
420,How can blockchain technology improve electoral transparency and security?,role
421,What are the psychological effects of long‑term space missions on astronauts?,role
422,Launch a new product in a saturated market.,cot
423,Analyze the relationship between education and economic growth.,role
424,What strategies can help students stay focused while studying?,cot
425,Develop a framework to improve disaster response coordination.,cot
426,What are the ethical implications of facial recognition in public surveillance?,role
427,Explain the cultural significance of the Silk Road.,role
428,Explain the differences between classical and operant conditioning.,role
429,Outline the steps required to launch a sustainable fashion line.,role
430,Develop a city-wide composting initiative.,cot
431,What strategies can restaurants implement to minimize food waste sustainably?,role
432,Explain methods to mitigate aviation emissions.,role
433,Discuss the significance of cultural heritage in contemporary society.,role
434,How can governments promote responsible artificial intelligence development while encouraging innovation and economic growth?,cot
435,How can societies balance civil liberties with public safety in times of crisis?,role
436,How do transportation policies affect gender equity in cities?,cot
437,What are the economic effects of universal basic‑income experiments?,role
438,What is the role of documentary photography in shaping environmental awareness?,role
439,How can arts-based interventions be integrated into public health programs to improve well-being and resilience?,cot
440,How can cross-sector partnerships address homelessness in metropolitan areas?,role
441,What are the core values and design elements of inclusive UX design?,role
442,What influence did the Enlightenment have on the modern concept of human rights?,role
443,Plan a conference focused on emerging technologies in education.,cot
444,Design a school schedule that supports adolescent sleep cycles.,cot
445,How can someone begin practicing mindfulness meditation?,cot
446,How can non-profit organizations measure and communicate their social impact to stakeholders and the public?,cot
447,Explore the effects of childhood education on lifelong learning.,role
448,What psychological principles make gamification an effective learning tool?,role
449,How does gender representation in STEM textbooks shape student aspirations?,role
450,How do digital learning platforms affect student motivation?,cot
451,What influences voter turnout in midterm elections?,cot
452,Describe how climate change affects ocean currents.,role
453,Summarize the causes of World War I.,role
454,Design a policy toolkit to support remote work infrastructure in rural areas.,cot
455,Analyze the impact of technology on interpersonal relationships.,role
456,Analyze the impact of urbanization on society.,role
457,What cultural role does street art play in urban identity formation?,role
458,Craft a science fiction plot involving a rogue AI that questions its own existence.,role
459,Propose a grant model that rewards nonprofit collaboration instead of competition.,cot
460,Explain the concept of sustainable agriculture.,role
461,How can a university better support students with disabilities?,cot
462,Investigate the relationship between art and mental health.,role
463,Can creative writing cultivate empathy and social understanding?,role
464,Explain the concept of genetic engineering.,role
465,Explain how memory works in the human brain.,role
466,How can a resume be made more appealing to employers?,cot
467,What are the most promising interdisciplinary research areas for advancing our understanding of human cognition?,cot
468,What role does creative placemaking play in community revitalization?,role
469,What role does music play in emotional regulation and memory processing?,role
470,Explore the concept of moral relativism.,role
471,What are the ethical responsibilities of influencers in shaping youth behavior?,role
472,Describe the benefits of creative writing.,role
473,Redesign a website for a local restaurant.,cot
474,What is the most effective strategy for a country to reduce air pollution from transportation without negatively impacting mobility?,cot
475,How can museums leverage digital technology to preserve and promote cultural heritage in a globalized world?,role
476,What are the benefits and limitations of telemedicine?,role
477,Propose a system to reduce plastic usage in local retail stores.,cot
478,Discuss the implications of autonomous vehicles.,role
479,Explain the principles of project management.,role
480,Discuss the implications of artificial intelligence in healthcare.,role
481,Discuss the implications of cultural appropriation.,role
482,Analyze the effects of childhood trauma on adult behavior.,role
483,Analyze the psychological effects of chronic stress.,role
484,What are the ecological principles guiding ecosystem restoration projects?,role
485,Describe the structure and function of neural networks in artificial intelligence.,role
486,What are common logical fallacies in arguments?,role
487,What are the psychological effects of prolonged social media exposure on adolescents?,cot
488,Explain the significance of critical pedagogy.,role
489,Explain the mechanics of tidal energy generation.,role
490,How should a government structure disaster preparedness and response systems for maximum community resilience?,cot
491,What are the ethical considerations of predictive analytics in social welfare systems?,role
492,Design a program to reduce food waste in college dining halls.,cot
493,Discuss the implications of virtual reality.,role
494,How do agricultural subsidies affect global food systems?,cot
495,How does the stock market respond to political events?,role
496,What are the benefits and limitations of universal basic income?,cot
497,How can schools better support students’ mental health?,cot
498,What are the best ways to learn a new language?,cot
499,What is the most effective international framework for addressing global cyber threats and promoting digital security?,cot
500,"How can mathematical modeling be used to inform decision-making in complex social systems, such as public health or urban planning?",cot
501,Analyze the potential and limitations of gene drives in ecosystem management.,role
502,Develop a roadmap to increase open access publishing in academic journals.,cot
503,Discuss the implications of digital privacy.,role
504,What is the best way to enhance customer service?,role
505,What strategies support climate adaptation in coastal cities?,cot
506,Explain the mechanics of the food chain.,role
507,What are the best strategies for maintaining work-life balance?,role
508,What approaches are most effective for preserving endangered minority languages in multilingual societies?,cot
509,"What would be the best approach to achieving universal health coverage in a diverse, multi-ethnic country with both urban and rural populations?",cot
510,Explain the role of statistics in data analysis.,role
511,What educational practices help reduce math anxiety in students?,cot
512,What causes food waste in restaurants and how can it be reduced?,cot
513,How can someone manage anxiety in high-pressure situations?,cot
514,How can public transportation systems be designed to meet the needs of aging populations?,cot
515,Explain the role of logic in mathematical proofs.,role
516,Explore the relationship between environmental degradation and public health in urban areas.,role
517,What are the evolutionary origins of human empathy and altruism?,role
518,Explain the significance of community engagement.,role
519,What steps should universities take to promote academic integrity and prevent research misconduct?,cot
520,What are effective strategies for cross‑cultural negotiation?,role
521,How can media literacy education help individuals navigate misinformation and develop critical evaluation skills?,cot
522,Analyze the impact of globalization on local cultures.,role
523,How can urban agriculture contribute to food security?,cot
524,Describe the process of scientific inquiry.,role
525,What factors affect the scalability of urban farming initiatives?,cot
526,Propose a tax policy to support small business resilience.,cot
527,Discuss techniques for urban rooftop farming.,role
528,Analyze the influence of transmedia storytelling on contemporary audience engagement.,role
529,Host a virtual event that keeps attendees engaged.,cot
530,What are the ethical dilemmas associated with artificial wombs?,cot
531,Improve team communication in a remote environment.,cot
532,Describe the architectural innovations of the Roman aqueducts.,role
533,How can cities encourage sustainable tourism without harming local culture?,cot
534,Create a workshop plan for enhancing creativity.,role
535,What are the most effective measures for preventing algorithmic bias in artificial intelligence systems used in finance?,cot
536,What’s the best way to improve writing skills?,cot
537,How does long-term unemployment affect community health indicators?,cot
538,How can AI-driven precision agriculture transform food security and environmental impact?,role
539,How can someone study effectively for exams?,cot
540,Explain the principles of design thinking.,role
541,Discuss the ethical implications of artificial intelligence in healthcare.,role
542,Design a certification process for sustainable event planning.,cot
543,What are the principles of secure API development?,role
544,Explain the concept of quantum entanglement.,role
545,Describe the principles of coding and programming.,role
546,Design a protocol for ensuring ethical sourcing in a global supply chain.,cot
547,Explain the mechanics of the human immune system.,role
548,Create a campaign to promote inclusive hiring practices in tech.,cot
549,How do cinematic techniques influence viewer emotion and memory?,role
550,How does music therapy help mental health patients?,role
551,What steps can cities take to ensure equitable access to high-speed internet for all residents?,cot
552,What are the structural causes of educational inequality in urban school systems?,role
553,Analyze the historical impact of maritime trade routes.,role
554,Analyze the impact of deforestation on indigenous communities.,role
555,Describe the economic impact of renewable energy subsidies.,role
556,Create an onboarding plan for employees at a fully remote startup.,cot
557,What comprehensive measures should a government take to address the root causes of homelessness?,cot
558,What is the role of peer support networks in mental health recovery?,role
559,Develop a personal learning plan for career growth.,cot
560,How can artificial intelligence assist in legal case analysis and justice equity?,role
561,Describe stages of grief and healthy coping mechanisms.,role
562,Evaluate the impact of climate migration on international stability and policy.,role
563,What is the most effective strategy for a city to support the creation and preservation of public visual art?,cot
564,How can artificial intelligence revolutionize early disease detection and diagnosis in healthcare?,role
565,Explain the mechanics of blockchain technology.,role
566,How can a national government prepare its workforce for the impact of automation and artificial intelligence?,cot
567,How does urban sprawl affect local ecosystems?,cot
568,What comprehensive policy could a government implement to tackle childhood obesity nationwide?,cot
569,Examine the impact of technology on interpersonal communication.,role
570,What is the best way to improve public speaking skills?,role
571,Analyze the significance of urban green spaces.,role
572,Develop a toolkit for schools to identify and support students with learning disabilities.,cot
573,Analyze the impact of artificial intelligence on education.,role
574,What factors contribute to the underrepresentation of women in engineering leadership?,cot
575,Outline history of encryption from ancient to quantum era.,role
576,How can public art installations foster urban healing after collective trauma?,role
577,Analyze the relationship between art and politics.,role
578,Propose improvements to airport security screening efficiency.,cot
579,How can literary analysis courses in universities remain rigorous while also being inclusive of diverse cultural perspectives?,cot
580,How can governments support the ethical and responsible use of big data in social policy development?,cot
581,Develop a strategy for handling difficult conversations.,cot
582,What are the ethical risks of using AI in job candidate screening?,cot
583,What methods can educators use to foster metacognitive awareness in students?,role
584,Create a plan for building long-term financial independence.,cot
585,What role do community libraries play in digital literacy and civic engagement?,role
586,Design a mentorship program for first-generation college students.,cot
587,Create a content strategy for a nonprofit organization.,role
588,What are the barriers to equitable vaccine distribution during global pandemics?,role
589,Explain the principles of architectural acoustics.,role
590,Explain how smart grids optimize electricity distribution.,role
591,Analyze the significance of the Enlightenment period.,role
592,How does light pollution affect ecosystems and biodiversity?,cot
593,What are the benefits and risks associated with intermittent fasting?,role
594,What role does gut microbiota play in human health?,role
595,What steps should a city take to improve air quality and public health in densely populated neighborhoods?,cot
596,What are the psychological mechanisms that underpin political polarization?,role
597,What are the key challenges in regulating cryptocurrency markets?,cot
598,How can machine learning improve disaster response and resilience?,role
599,Propose a redesign of a high-traffic urban intersection.,cot
600,Summarize the significance of the Renaissance.,role
601,How can urban planners foster inclusive public spaces that encourage social interaction and community well-being?,cot
602,Why do people believe in conspiracy theories?,role
603,What factors improve outcomes in disaster-resilient housing?,cot
604,How can a national science policy be structured to foster both basic research and commercial innovation?,cot
605,How do generative AI tools reshape creative industries?,cot
606,What are the best strategies for improving mental health?,role
607,How can large-scale festivals reduce their environmental footprint?,cot
608,What strategies should universities adopt to encourage open access publishing while maintaining academic quality?,cot
609,How do platform economies affect labor rights in the gig sector?,role
610,Discuss the implications of renewable energy sources.,role
611,Analyze the role of women in the workforce.,role
612,Evaluate the economic trade-offs of universal basic income policies.,role
613,Describe the vaccine‑development process for emerging infectious diseases.,role
614,What are the fundamental principles of Stoic philosophy?,role
615,Design a remote internship program for undergraduates.,cot
616,What role does public art play in shaping community identity?,cot
617,Design a training module for ethical data collection in field research.,cot
618,What strategies can schools use to reduce chronic absenteeism?,cot
619,Examine the socioeconomic and psychological consequences of long-term unemployment on individuals and communities.,role
620,Create a safety protocol for reopening a public pool.,cot
621,Design a civic engagement app for local government.,cot
622,How can peer tutoring improve student learning outcomes?,cot
623,How can behavioral economics principles be applied to promote healthier lifestyle choices among the general public?,cot
624,What is the most efficient way for a government to transition its national energy grid to renewable sources?,cot
625,What collaborative frameworks support cross-border conservation of migratory species?,role
626,Develop a proposal for a low-cost water purification system for rural areas.,cot
627,Explore the concept of innovation in business.,role
628,How can statistical literacy programs be developed for adults to combat misinformation and promote informed citizenship?,cot
629,How do tax incentives influence renewable energy adoption by corporations?,cot
630,Explain the differences between major and minor musical scales in a beginner‑friendly way.,role
631,Explain the concept of digital citizenship.,role
632,What is the most effective way for museums to balance preservation of artifacts with public accessibility and engagement?,cot
633,How do youth-led climate movements influence environmental policy?,role
634,Explore the concept of self-care in mental health.,role
635,Discuss the implications of automation on the workforce.,role
636,What approach should a government take to modernize its healthcare data systems for improved patient outcomes and privacy?,cot
637,Analyze the philosophical debate between free will and determinism.,role
638,What strategies can a school district use to improve student mental health and well-being at all grade levels?,cot
639,Formulate a strategy for combating misinformation in multilingual communities.,cot
640,How can architecture support community healing after trauma?,cot
641,Organize a digital photo library across multiple devices.,cot
642,What are the core principles of user experience (UX) design in mobile applications?,role
643,Describe the concept of machine learning.,role
644,What are the economic trade-offs of free public college tuition?,cot
645,How do blockchain-powered supply chains advance ethical sourcing and anti-counterfeiting?,role
646,Plan a national archive system for preserving oral histories.,cot
647,How can the humanities inform ethical AI development?,role
648,Describe the philosophical tension between utilitarianism and deontological ethics in medical decision-making.,role
649,How can visual arts programs in K–12 schools be designed to support cognitive development and cultural awareness?,cot
650,What approaches can technology companies take to minimize environmental impact across product life cycles?,cot
651,Discuss the implications of space exploration for humanity.,role
652,Explore the concept of mindfulness in psychology.,role
653,Explain the mechanics of the stock market.,role
654,How do noise levels in schools affect learning outcomes?,cot
655,What makes public transportation systems successful in major cities?,cot
656,Design a plan to implement composting in a corporate office setting.,cot
657,What strategies strengthen indigenous food systems in the face of climate change?,role
658,Outline a public awareness campaign on water conservation.,cot
659,What steps can someone take to build emotional resilience?,cot
660,What are the public health benefits of urban green spaces?,role
661,What is the most effective strategy for a city to support the creation and preservation of public visual art?,cot
662,Examine the role of digital storytelling in preserving Indigenous knowledge systems.,role
663,Design an evaluation system for measuring nonprofit impact.,cot
664,What causes ocean acidification and how can we mitigate its effects?,role
665,Analyze the impact of automation on the workforce.,role
666,How can public health campaigns effectively shift social norms around stigmatized health behaviors?,role
