id,user_prompt,technique
1,Explain the concept of the scientific community.,role
2,Create a plan to transition a community to renewable energy.,cot
3,How do smart grids optimize electricity distribution?,role
4,How can urban green corridors mitigate heat islands and promote ecosystem connectivity?,role
5,How can feminist ethics reshape corporate social responsibility strategies?,role
6,What design strategies improve wayfinding in large public buildings?,cot
7,How do linguistic structures shape cognitive perception?,role
8,What is the psychological impact of color in branding and advertising?,role
9,How can systems thinking guide climate adaptation strategies?,role
10,How can someone become a better leader at work?,cot
11,How can local governments design effective participatory budgeting processes that genuinely reflect community priorities?,cot
12,What are the advantages of electric vehicles?,role
13,Analyze the long-term effects of remote work on commercial real estate.,cot
14,What strategies support lifelong learning in aging populations?,cot
15,Plan an online course for teaching climate science to high school students.,cot
16,Explore the concept of economic inequality.,role
17,How can science museums enhance STEM interest among children?,cot
18,Analyze the effects of urban sprawl on community well-being.,role
19,Analyze how pandemics historically reshape social institutions and cultural norms.,role
20,What strategies improve language acquisition in adult learners?,cot
21,Set up a study group that actually works.,cot
22,Organize a local fundraiser for a cause.,cot
23,How can sleep deprivation impact productivity?,role
24,What strategies are most effective for teaching scientific literacy to adults outside traditional academic settings?,cot
25,Evaluate the promise and perils of neuroenhancement technologies in academia.,role
26,Develop a data collection plan for a field research project.,cot
27,How does deforestation in the Amazon affect global climate patterns?,cot
28,What is the best way to develop a personal brand?,role
29,Discuss the implications of privacy in the digital age.,role
30,How does someone figure out the right career path?,cot
31,What are the barriers to adoption of telehealth in low-income populations?,cot
32,Prepare for a panel interview.,cot
33,Discuss the implications of social media on political discourse.,role
34,What principles guide ethical storytelling in journalism and documentary filmmaking?,role
35,How can someone prepare for a job interview effectively?,cot
36,How does systemic racism manifest in healthcare access and outcomes?,role
37,Discuss the economic effects of immigration.,role
38,What are the most promising approaches for promoting sustainable design in civil engineering projects?,cot
39,What is the best approach for a country to support small and medium-sized enterprises (SMEs) in the digital economy?,cot
40,Summarize the key events of the American Civil Rights Movement.,role
41,What steps should be taken to ensure equitable distribution of emerging medical technologies in both high- and low-resource settings?,cot
42,Create a public dashboard to monitor water quality in real-time.,cot
43,How can psychological principles be applied to improve the design and impact of public health messaging?,cot
44,How can neuroscience findings about brain plasticity be incorporated into adult education and workforce retraining programs?,cot
45,How can interdisciplinary teams be supported to solve complex societal problems such as inequality or climate change?,cot
46,What are the best ways to save money on a tight budget?,cot
47,How can someone eat healthier on a busy schedule?,cot
48,How can policymakers design effective incentives to promote circular economy principles in industry?,cot
49,Describe the benefits of meditation.,role
50,How do renewable energy transitions impact geopolitical power dynamics?,role
51,Describe strategies to combat antibiotic resistance.,role
52,Design a program to reduce screen time among children without relying on punishment.,cot
53,How can a country design a comprehensive immigration policy that promotes economic growth while ensuring social cohesion?,cot
54,What ethical frameworks guide the use of robotics in elder care?,role
55,How can financial regulators encourage responsible innovation in the fintech sector without compromising consumer protection?,cot
56,What makes environmental education programs effective?,cot
57,What methods increase participation in public consultations?,cot
58,How do smart cities balance data collection with citizen privacy?,role
59,What are the cognitive and societal implications of long-term space colonization?,role
60,How can a government promote responsible use of artificial intelligence in law enforcement while protecting civil liberties?,cot
61,Describe the process of scientific research.,role
62,What are the effects of urban tree canopy loss on city microclimates?,cot
63,What are the steps to start a small online business?,role
64,How can public libraries adapt to the digital age?,cot
65,What policies can reduce energy consumption in high-rise buildings?,cot
66,How can a national transportation policy reduce greenhouse gas emissions while supporting economic growth?,cot
67,How can an international organization coordinate a global response to emerging infectious diseases?,cot
68,What are the most effective habits for maintaining good physical health?,cot
69,How can businesses reduce their carbon footprint?,role
70,How can someone start a podcast successfully?,cot
71,What strategies are most effective for engaging citizens in local environmental conservation initiatives?,cot
72,Explain the concept of cultural relativism.,role
73,What are the benefits and risks of integrating generative AI into the creative arts?,role
74,What role does mentorship play in STEM career development?,cot
75,How can philosophy courses in secondary education be designed to promote ethical reasoning and civic responsibility?,cot
76,How should a nation promote the integration of renewable energy technologies within the chemical manufacturing industry?,cot
77,Analyze the social impact of esports.,role
78,Advise on developing critical thinking skills.,role
79,What challenges arise when integrating AI into law enforcement?,cot
80,Discuss the importance of STEM education in the 21st century.,role
81,Create a plan for improving gender inclusivity in sports organizations.,cot
82,How does access to nature affect childhood development?,cot
83,Describe how blockchain technology can be used to secure digital voting systems.,role
84,Explain the role of the United Nations in global governance.,role
85,How can early childhood education reduce long-term academic disparities?,role
86,Create an onboarding manual for new volunteers.,cot
87,How can policymakers ensure the sustainable management of water resources in regions facing scarcity and competing demands?,cot
88,How can space-based technologies support climate change mitigation on Earth?,role
89,Design a certification pathway for community health workers.,cot
90,Explain the economic concept of comparative advantage.,role
91,Create a strategic plan to expand a local nonprofit.,cot
92,Formulate a national strategy for electric vehicle adoption.,cot
93,Streamline a morning commute for efficiency.,cot
94,How should a country structure its tax system to reduce income inequality while supporting economic growth?,cot
95,What makes behavioral nudges effective in public policy?,cot
96,What factors drive the success of language revitalization movements?,role
97,What are the ethical implications of facial recognition in public surveillance?,role
98,Discuss the role of critical thinking in education.,role
99,How can historians ensure accuracy and objectivity when interpreting contentious or politically charged historical events?,cot
100,Create a content calendar for a small business.,role
101,Explain the principles of circular economy in manufacturing.,role
102,Plan a solo international trip safely and affordably.,cot
103,Design a mobile app to connect local artists with exhibition spaces.,cot
104,What impact does short-term rental proliferation have on local housing markets?,cot
105,Launch a newsletter for a creative project.,cot
106,Explain the role of antioxidants in human health.,role
107,Advise on effective leadership styles.,role
108,How can healthcare systems ensure equitable access to mental health services in rural and underserved communities?,cot
109,How can an educational institution create a culture of academic integrity and prevent cheating?,cot
110,What should be considered before adopting a pet?,cot
111,Explain the technology behind facial recognition.,role
112,What are the psychological effects of long‑duration spaceflight on astronauts?,role
113,Design an initiative to improve accessibility in online education platforms.,cot
114,Describe the benefits of physical fitness.,role
115,Write a short story about a scientist discovering a new species.,role
116,How do digital platform monopolies affect small media enterprises?,role
117,What is the importance of biodiversity?,role
118,Create a city ordinance to limit nighttime noise pollution.,cot
119,What are the benefits and risks associated with intermittent fasting?,role
120,What policies could most effectively encourage ethical use of emerging biotechnologies in medicine and agriculture?,cot
121,Discuss the importance of historical literacy.,role
122,Design a daily checklist for time management.,cot
123,How can a small business increase its online sales?,cot
124,What are the foundations of intersectional feminist theory?,role
125,How can international development agencies support gender equality in technology and innovation sectors?,cot
126,How can cities implement smart‑transportation to reduce congestion?,role
127,What is the most effective way to use machine learning for early detection and prevention of disease outbreaks?,cot
128,How can a university encourage greater participation in STEM fields among women and underrepresented minorities?,cot
129,Explain key metrics for evaluating machine‑learning models.,role
130,Design a curriculum for teaching digital literacy.,cot
131,What are the ethical boundaries of synthetic biology?,role
132,How does biophilic design enhance productivity in workplaces?,role
133,How can visual storytelling techniques be used to improve communication of complex scientific concepts to the general public?,cot
134,Discuss the significance of scientific literacy.,role
135,Describe the role of statistics in public health.,role
136,Explain the mechanics of the carbon cycle.,role
137,Analyze the relationship between art and mental health.,role
138,What strategies can restaurants use to minimize food waste sustainably?,role
139,Start a podcast on niche industry topics.,cot
140,Analyze the benefits of plant-based diets.,role
141,How does ecological restoration support biodiversity and human well-being?,role
142,Discuss the implications of the gig economy.,role
143,How can AI be designed to preserve rather than homogenize linguistic diversity?,role
144,How does neuroplasticity influence rehabilitation after brain injury?,role
145,Explore methods for sustainable tourism development.,role
146,What are core principles of user‑experience (UX) design in mobile apps?,role
147,What cognitive mechanisms underlie false memory formation?,role
148,Examine how zoning laws influence affordable housing.,cot
149,How can machine learning models be made more transparent and interpretable?,cot
150,How can cities reduce traffic congestion without expanding roadways?,cot
151,How does urban noise pollution impact mental health?,cot
152,Develop a mentorship framework for transitioning veterans into tech careers.,cot
153,Propose an incentive model to promote green construction in urban areas.,cot
154,How does cultural background affect perception of facial expressions?,cot
155,How does prison architecture influence rehabilitation?,cot
156,Explain the concept of quantum computing.,role
157,What are ways to strengthen critical thinking skills?,cot
158,Write a short story about a magical artifact.,role
159,Improve team morale during stressful projects.,cot
160,What governance structures best ensure ethical AI development at a corporate level?,role
161,Analyze the impact of digital technology on education equity.,role
162,Discuss the implications of artificial intelligence in education.,role
163,What is the best way to invest in real estate?,role
164,What coordinated international strategies are needed to advance the search for life beyond Earth?,cot
165,Design a legal framework for regulating biometric surveillance technologies.,cot
166,Describe the benefits of lifelong learning.,role
167,Propose a system for transparent lobbying disclosure.,cot
168,What factors influence the success of bilingual education programs?,cot
169,Explain the principles of UX design.,role
170,How can a national education ministry support lifelong learning for adults in a rapidly changing job market?,cot
171,What are the social effects of long-term digital exclusion?,cot
172,Explore the ethical considerations in medical research.,role
173,"How can academic institutions support faculty in balancing research, teaching, and service responsibilities?",cot
174,How is virtual reality applied in medical training?,role
175,Create a disaster relief fund framework for rapid response.,cot
176,What is the significance of the precautionary principle in environmental science?,role
177,What are the benefits and limitations of universal basic income?,cot
178,How can data visualization enhance decision-making in public policy?,role
179,What role can digital literacy play in preventing cyber-victimization among adolescents?,role
180,Create a data-sharing agreement template for cross-institutional research.,cot
181,Discuss the role of community service in personal development.,role
182,Explore the role of government in economic regulation.,role
183,How can digital platforms be designed to minimize addictive behaviors and maximize user well-being?,cot
184,Write a workshop proposal for a professional conference.,cot
185,How does early childhood trauma affect educational attainment later in life?,cot
186,Evaluate the long-term sustainability of desalination as a solution to global freshwater scarcity.,role
187,What best practices enhance digital accessibility on websites?,role
188,How do gender norms evolve and persist across cultures and history?,role
189,How can virtual learning environments be optimized to support diverse learning styles and neurodiversity?,role
190,Create a proposal to support incarcerated individuals in completing higher education.,cot
191,Propose a governance model for ethical AI research.,cot
192,Plan a campaign to boost voter turnout in a midterm election.,cot
193,How does automation reshape employment in developing economies?,cot
194,What lessons do ancient urban systems offer for modern sustainable city design?,role
195,What are the best methods for government agencies to combat the spread of misinformation during public health crises?,cot
196,Explain the concept of renewable energy sources.,role
197,Explain the importance of cybersecurity in modern healthcare.,role
198,Develop a system for evaluating new business ideas.,cot
199,How can artificial intelligence improve healthcare delivery?,cot
200,How can a school district close achievement gaps between students from different socioeconomic backgrounds?,cot
201,Analyze the impact of technology on interpersonal relationships.,role
202,What are the principles of ethical AI design in healthcare applications?,role
203,What are effective ways to learn a new language quickly?,role
204,What’s the best approach to starting a side hustle?,cot
205,How do global supply chain disruptions impact labor practices and consumer protection?,role
206,Explore the concept of emotional intelligence.,role
207,Outline a strategy to reduce plastic consumption in a retail store.,cot
208,Discuss the historical significance of the civil rights movement.,role
209,How should a government develop a climate adaptation strategy for coastal cities threatened by rising sea levels?,cot
210,What is the most effective approach for fostering curiosity and independent research skills in undergraduate students?,cot
211,Advise on stress reduction techniques.,role
212,How does access to early childhood education impact long-term outcomes?,cot
213,Discuss the implications of 3D printing technology.,role
214,What steps should a beginner take to start investing?,cot
215,What factors influence the ethical use of consumer data?,cot
216,How should an organization design an ethical AI hiring system that avoids bias and promotes diversity?,cot
217,What are the risks of relying on algorithms in judicial sentencing?,cot
218,Prepare for a networking event as a shy person.,cot
219,Explain how black holes form and why they are important in astrophysics.,role
220,What are the psychological impacts of living through climate disasters in childhood?,role
221,Explore the effects of sleep on cognitive performance.,role
222,What role does play have in adult learning and innovation?,cot
223,What are the best practices for ensuring ethical and accurate use of statistics in media reporting?,cot
224,What are the best practices for conflict resolution?,role
225,How does speculative fiction interrogate technological dystopias?,role
226,Develop a mentorship program for first-generation college students.,cot
227,Discuss the implications of technological advancements on privacy.,role
228,How do museums decide what narratives to include or exclude in exhibitions?,role
229,What approach can a government take to promote affordable and sustainable housing in major cities?,cot
230,Explain the principle of supply and demand in economics.,role
231,"How can classical music organizations attract younger, more diverse audiences without compromising artistic standards?",cot
232,How can educators effectively teach the fundamentals of logic and reasoning to undergraduate students across different disciplines?,cot
233,How do poetic forms reflect political resistance in postcolonial literature?,role
234,What makes government transparency initiatives successful?,cot
235,Explain the principles of negotiation.,role
236,How can critical media literacy combat misinformation in social networks?,role
237,What role do data collaboratives play in pandemic preparedness?,role
238,Describe how blockchain technology can be used to secure digital voting systems.,role
239,What is the most effective way to improve early childhood literacy in low-income urban areas?,cot
240,Discuss the implications of renewable energy.,role
241,Discuss the implications of biotechnology in medicine.,role
242,What is an effective approach to learning data science?,cot
243,How does gentrification affect public school demographics?,cot
244,Design a study schedule for final exams.,cot
245,How do zoning laws influence food accessibility in urban neighborhoods?,cot
246,Write a short story about a superhero with an unusual power.,role
247,Plan a budget-conscious holiday celebration.,cot
248,How does art impact mental wellbeing and recovery?,role
249,How does digital surveillance impact democratic institutions and civil liberties?,role
250,Explain the basics of weather forecasting.,role
251,What role do rituals play in social cohesion and identity formation?,role
252,What are the best strategies for financial literacy?,role
253,What are the socio-legal impacts of algorithmic sentencing in criminal justice?,role
254,What is the best way to prepare for a long-distance move?,cot
255,How can coworkers build stronger relationships?,cot
256,Create a guide for transitioning to a plant-based diet.,cot
257,Explain the principles of sustainable agriculture.,role
258,Analyze the impact of social media on mental health.,role
259,Write a cover letter tailored to a specific job.,cot
260,Describe how CRISPR gene editing works and what diseases it could cure.,role
261,Analyze the causes and consequences of the Great Depression.,role
262,How does climate migration reshape urban infrastructure planning?,cot
263,Explain the concept of dark matter and its role in cosmology.,role
264,What role do biomimicry and nature-inspired design play in sustainable innovation?,role
265,How can someone make friends after moving to a new city?,cot
266,Advise on workplace diversity and inclusion.,role
267,Discuss the implications of space exploration.,role
268,Explore the role of scientific research in public policy.,role
269,Outline the steps required to launch a sustainable fashion line.,role
270,What are the essential steps in designing a robust clinical trial for a new pharmaceutical treatment?,role
271,How could a government design a national digital literacy initiative that bridges the gap between urban and rural populations?,cot
272,Develop a framework for community policing in high-crime neighborhoods.,cot
273,What are best practices for digital accessibility on websites?,role
274,How does algorithmic recommendation influence political polarization online?,role
275,What approach should a nation take to foster sustainable economic development while safeguarding natural ecosystems?,cot
276,What financial skills are most valuable to learn in your 20s?,cot
277,Discuss the implications of cryptocurrency on traditional banking.,role
278,How do moral injury and PTSD differ in military mental health?,role
279,What are ways to overcome procrastination?,cot
280,What is the best way to start a blog?,role
281,Analyze the significance of the Civil Rights Movement.,role
282,Summarize the history of the civil rights movement in the U.S.,role
283,Explain microplastics' impact on marine ecosystems.,role
284,What role does diet play in managing mental health conditions?,cot
285,What is the most effective way for schools to address learning loss resulting from prolonged disruptions such as pandemics?,cot
286,How should global history curricula be updated to reflect contemporary challenges and foster intercultural understanding?,cot
287,Analyze the role of technology in environmental conservation.,role
288,Explain the concept of cognitive dissonance.,role
289,How can civil engineers design urban infrastructure that is resilient to both natural and human-made disasters?,cot
290,Analyze the impact of algorithmic bias in artificial intelligence systems used in criminal justice.,role
291,How can public libraries evolve to remain relevant in the digital age and serve as centers for community learning?,cot
292,How can blockchain enable transparent charitable donations?,role
293,How do neural networks learn from data?,role
294,Analyze the impact of automation on rural employment.,cot
295,Create a personal website to showcase work.,cot
296,Design a public campaign to improve vaccination uptake among adults.,cot
297,Explain urban heat islands and their mitigation.,role
298,How does open source software development influence global tech equity?,role
299,What is the best way to enhance emotional intelligence?,role
300,Transition from college to a full-time job.,cot
301,Discuss the historical role of trade unions.,role
302,Develop a habit of consistent journaling.,cot
303,What are the implications of AI-generated art for intellectual property law?,role
304,Explain how sensory marketing influences consumers.,role
305,How should a nation develop a water management strategy in response to increasing droughts and unpredictable rainfall?,cot
306,Develop a plan to teach conflict resolution in elementary schools.,cot
307,Create a plan to reduce food waste at home.,cot
308,What policies could most effectively address the digital divide in rural and underserved urban communities?,cot
309,Examine the impact of climate change on global economies.,role
310,How can teachers use formative assessment to guide instruction and support diverse learners?,cot
311,How can civil engineers design urban infrastructure that is resilient to both natural and human-made disasters?,cot
312,How can design thinking foster innovation in public service delivery?,role
313,Analyze the impact of artificial reefs on marine life.,role
314,How can an education system be reformed to cultivate critical thinking and creativity in students across all grade levels?,cot
315,How do I learn coding?,role
316,Plan a university initiative to reduce food insecurity on campus.,cot
317,What are the risks and benefits of gene editing in agriculture?,cot
318,What are the long-term psychological effects of growing up in conflict zones?,role
319,Discuss the implications of climate change for future generations.,role
320,What are the ethical concerns around surveillance technologies in schools?,cot
321,What steps should be taken to ensure responsible development and deployment of autonomous vehicles on public roads?,cot
322,What coordinated international strategies are needed to advance the search for life beyond Earth?,cot
323,What are the socioeconomic effects of universal broadband in underserved rural communities?,role
324,Create a weekend routine that supports rest and reflection.,cot
325,What barriers limit access to mental health care in low-income communities?,cot
326,What are the key skills needed to become a software engineer?,cot
327,What are the core techniques behind realistic character development in literary fiction?,role
328,Discuss the implications of youth activism in social change.,role
329,What challenges do indigenous communities face in land conservation?,cot
330,Host a recurring book club for personal growth.,cot
331,What measures should a city take to preserve its architectural heritage while accommodating population growth and modernization?,cot
332,Propose a redesign of after-school programs to better support working families.,cot
333,How can virtual reality be used in medical training?,role
