id,user_prompt,technique
667,How can science journalism maintain public trust during health crises?,cot
668,What is the role of metaphor in shaping scientific understanding?,role
669,What are the best practices for effective teamwork?,role
670,Design a disaster response dashboard for regional authorities.,cot
671,Plan a community clean-up event that drives engagement.,cot
672,Host a budget-friendly dinner party.,cot
673,Discuss the ethical considerations of drone surveillance.,role
674,How can someone stay motivated while working from home?,cot
675,What makes tabletop role‑playing games (RPGs) an engaging form of storytelling?,role
676,What steps can be taken to ensure equitable representation of diverse voices in national arts and cultural institutions?,cot
677,How do large-scale infrastructure projects shape regional economic development?,role
678,Analyze the impact of globalization.,role
679,Discuss the importance of cultural heritage preservation.,role
680,What is the most effective way for citizens to participate in local government and influence policy decisions?,cot
681,How can narrative therapy empower survivors of domestic abuse?,role
682,Explore the ethical dilemmas of genetic engineering.,role
683,What factors influence the reliability of eyewitness testimony?,cot
684,What strategies can be employed to reduce social isolation and promote community well-being in urban environments?,cot
685,Discuss the significance of historical preservation.,role
686,How do housing policies impact urban segregation patterns?,cot
687,What approaches are most effective for using storytelling to preserve endangered oral traditions and cultural heritage?,cot
688,Analyze the impact of climate policy on businesses.,role
689,How can advances in neuroscience research be translated into practical interventions for improving mental health?,cot
690,How does quantum computing differ from classical computing?,role
691,Summarize the major events of World War II.,role
692,How does school funding inequality affect educational mobility?,cot
693,How do after-school programs impact youth development?,cot
694,How can small businesses improve cash‑flow during economic downturns?,role
695,Create a workflow to verify factual accuracy in educational materials.,cot
696,How do protest art and performance catalyze political change?,role
697,Create a risk assessment plan for reopening schools after a natural disaster.,cot
698,How does language influence scientific thinking?,cot
699,What are the best practices for online learning?,role
700,Explain the mechanics of sound waves.,role
701,Prepare a workshop on financial literacy for high school students.,cot
702,Discuss the importance of storytelling in business.,role
703,Describe the benefits of team sports.,role
704,What factors influence vaccine hesitancy in different populations?,cot
705,How can interdisciplinary science education in secondary schools be structured to foster curiosity and problem-solving?,cot
706,What approach should a city use to modernize its waste management system for sustainability and efficiency?,cot
707,How do you build trust in a team environment?,role
708,Start a blog to share ideas consistently.,cot
709,How can wearable biosensors support chronic disease management?,cot
710,Explain the principles of effective negotiation.,role
711,What role do community land trusts play in affordable housing?,cot
712,Create a workshop plan for developing leadership skills.,role
713,Create a fundraising plan for a community project.,role
714,What steps can a society take to ensure the long-term preservation of endangered languages?,cot
715,Create a digital archive system for a local museum.,cot
716,How can organizations build a strong company culture in remote teams?,role
717,How can someone build a strong personal brand online?,cot
718,How can governments address the challenges of regulating emerging biotechnologies while supporting innovation?,cot
719,What mechanisms are necessary to ensure ethical AI governance at the international level?,role
720,What are the key components of effective anti-bullying programs in schools?,cot
721,How does AI-enabled predictive maintenance transform industrial sustainability?,role
722,What is the most robust framework for analyzing ethical dilemmas in rapidly evolving technological fields?,cot
723,Describe the process of photosynthesis in simple terms.,role
724,Discuss the implications of genetic testing.,role
725,How can organizations build a strong company culture in remote teams?,role
726,How can the teaching of probability and statistics in high school be improved to promote real-world understanding and critical thinking?,cot
727,Summarize the history of feminism.,role
728,What factors contribute to the successful reintegration of formerly incarcerated individuals?,cot
729,What are the essential principles for secure API design?,role
730,What are the most effective pedagogical approaches for teaching empathy in primary and secondary education?,cot
731,How can small businesses leverage digital tools to enhance competitiveness and adapt to changing markets?,cot
732,How can humanitarian logistics be optimized for rapid disaster relief?,role
733,What is the most effective approach for teaching data ethics to undergraduate computer science majors?,cot
734,Discuss the importance of financial literacy.,role
735,How can museums leverage virtual and augmented reality technologies to create more immersive and accessible experiences for diverse audiences?,cot
736,What role do libraries play in bridging the digital divide?,cot
737,Discuss the role of technology in modern education.,role
738,Describe architectural innovations of Roman aqueducts.,role
739,Build a professional portfolio from scratch.,cot
740,What makes tabletop RPGs an immersive storytelling medium?,role
741,How can inclusive sport programming foster community cohesion among refugees?,role
742,How can educators effectively teach the fundamentals of logic and reasoning to undergraduate students across different disciplines?,cot
743,How do place-based pedagogies transform environmental education?,role
744,Analyze how implicit bias influences hiring practices in corporate environments.,role
745,Discuss the evolution of human language over time.,role
746,What role does gut‑microbiome play in human health?,role
747,Summarize the key events of the Cold War.,role
748,Analyze the importance of critical thinking skills.,role
749,How can business leaders cultivate ethical decision-making cultures in fast-growing organizations?,cot
750,Describe how 3D printing is revolutionizing prosthetics.,role
751,Explore the concept of identity in psychology.,role
752,How can a public health system respond effectively to an unexpected epidemic outbreak?,cot
753,Describe the process of vaccine development for emerging viruses.,role
754,Describe the stages of grief and healthy coping mechanisms.,role
755,What makes a mental health intervention culturally competent?,cot
756,Improve the onboarding process for new employees.,cot
757,What is the psychological impact of color in branding and advertising?,role
758,Summarize the history of the internet.,role
759,Discuss the ethical implications of artificial intelligence in the workplace.,role
760,How does access to clean cooking fuel affect women's health in rural areas?,cot
761,What are the best strategies for public health campaigns to increase vaccination rates in hesitant populations?,cot
762,Explore the ethical considerations in environmental conservation.,role
763,Develop a framework for ethical drone use in humanitarian contexts.,cot
764,How can universities foster interdisciplinary collaboration?,cot
765,What challenges arise when regulating deepfake technology?,cot
766,How does quantum computing differ from classical computing?,role
767,Discuss the significance of language in cultural identity.,role
768,How does transit-oriented development affect housing affordability?,cot
769,What role do design standards play in ensuring web accessibility?,cot
770,Explain the principles of sustainable development.,role
771,What role does sleep quality play in academic performance among college students?,cot
772,Create an outline for a self-published ebook.,cot
773,What are the implications of wearable biosensors for personalized health?,role
774,What is the most effective way to teach logical reasoning and argumentation skills to secondary school students?,cot
775,Discuss the role of leadership in organizational success.,role
776,What is the optimal way to transition an economy from fossil fuels to renewable energy while minimizing job loss and social disruption?,cot
777,What is the most effective way to balance protection of individual rights and promotion of public safety in national security policy?,cot
778,Create a curriculum module on media literacy for middle school students.,cot
779,Explore how literature serves as a form of resistance under oppressive regimes.,role
780,How can startups scale ethically without sacrificing employee well-being?,role
781,Write a short story about a friendship between two unlikely characters.,role
782,What are the best practices for ensuring ethical and accurate use of statistics in media reporting?,cot
783,How does financial literacy impact retirement security?,cot
784,How does AI-driven language translation influence minority language preservation?,role
785,What policies reduce childhood obesity most effectively?,cot
786,What policy changes help reduce recidivism rates?,cot
787,Explain the significance of renewable energy sources.,role
788,How does 5G technology work?,role
789,How can universities promote interdisciplinary research that bridges the gap between the sciences and the humanities?,cot
790,Explain how photosynthesis works in plants and why it matters for life on Earth.,role
791,How do corporate lobbying practices influence environmental regulation?,cot
792,Explain how black holes form and why they are important in astrophysics.,role
793,Create a timeline for implementing a carbon-neutral plan in a university.,cot
794,Explain the role of mentorship in personal growth.,role
795,Describe the science behind earthquake-resistant architecture.,role
796,Describe the historical development of encryption methods.,role
797,What are the consequences of algorithmic moderation on freedom of expression?,cot
798,How does art therapy support mental well‑being?,role
799,Analyze the impact of social media on mental health.,role
800,"How could a city redesign its public transportation system to maximize accessibility, sustainability, and economic growth?",cot
801,Describe a hypothetical scenario where humans colonize Mars.,role
802,What are the neural mechanisms underlying decision-making under stress?,role
803,Explore the concept of emotional intelligence.,role
804,What are the long-term consequences of declining biodiversity?,cot
805,What are the most effective approaches for teaching critical data interpretation skills in high school science courses?,cot
806,Make a habit of reading more nonfiction.,cot
807,Describe the philosophical tension between scientific realism and anti-realism.,role
808,How does urban sprawl influence regional water management?,cot
809,What techniques build suspense in thriller writing?,role
810,Design a volunteer program for environmental restoration.,cot
811,What drives disparities in maternal healthcare outcomes across racial groups?,cot
812,How can cities design parks to serve diverse communities?,cot
813,Evaluate the impact of ride-sharing services on urban traffic.,cot
814,How can a graphic designer start freelancing?,cot
815,How can circular economy principles disrupt fast fashion culture?,role
816,How can rural areas attract and retain medical professionals?,cot
817,How does narrative framing affect climate change communication efficacy?,role
818,How can advanced mathematics instruction be adapted to serve both high-achieving students and those needing extra support within the same classroom?,cot
819,Explain how holography works.,role
820,Develop a plan to modernize an outdated public library.,cot
821,How can urban design reduce pedestrian fatalities?,cot
822,What role does digital forensics play in international human rights investigations?,role
823,What are the implications of digital twins in urban planning and sustainability?,role
824,Describe the benefits of learning a second language.,role
825,How do patent laws influence pharmaceutical innovation?,cot
826,Explain the principles of effective time management.,role
827,Build an emergency savings fund with limited income.,cot
828,How can computational social science forecast political unrest?,role
829,How can financial literacy programs be designed to empower individuals across socioeconomic backgrounds to make informed financial decisions?,cot
830,Analyze the principles of behavioral economics.,role
831,How can scientific publishers foster open peer review while maintaining rigorous quality standards?,cot
832,What challenges and opportunities does quantum computing pose to modern cryptography?,role
833,Examine the significance of the Renaissance in shaping modern art.,role
834,Discuss the economic impact of the gig economy.,role
835,Analyze the impact of economic sanctions on international relations.,role
836,What are effective ways to reduce plastic waste in a community?,cot
837,Design a time management system for graduate students.,cot
838,What is the most effective way to promote sustainable tourism in ecologically sensitive regions?,cot
839,Which strategies support students with ADHD in academics?,role
840,Plan a zero-waste event for a community organization.,cot
841,How can social science research methods be adapted to capture rapidly changing trends in digital culture?,cot
842,Discuss the impact of globalization on labor standards.,role
843,What is the most effective way to incorporate indigenous knowledge into climate science research and policy?,cot
844,Explore the psychological theories behind motivation.,role
845,What are the ethical challenges of predictive policing technologies?,role
846,What are the implications of dark matter research for fundamental physics and cosmology?,role
847,What contributes to the decline of pollinator populations?,cot
848,Describe the benefits of public speaking.,role
849,How can financial literacy be effectively taught in high schools?,cot
850,What strategies can students use to improve focus while studying?,role
851,How can decentralized finance (DeFi) democratize financial access globally?,role
852,What ethical implications arise from neurodata collection in consumer wearables?,role
853,Create a system to track personal goals.,cot
854,How can parents support bilingual language development in children?,role
855,How does access to green space correlate with community mental health?,cot
856,Create a plan to help food-insecure families access healthy meals.,cot
857,What factors contribute to teacher burnout in public schools?,cot
858,How can someone create a successful blog?,cot
859,How do cultural values shape mental health stigma?,cot
860,Explain quantum entanglement in layman's terms.,role
861,What strategies support equitable integration of refugees into urban economic systems?,role
862,How do national identity narratives shape global migration policies?,role
863,Explain the fundamentals of microeconomics.,role
864,How does wildfire smoke affect urban public health?,cot
865,How can a country reform its criminal justice system to reduce recidivism and promote rehabilitation?,cot
866,What frameworks ensure ethical research involving vulnerable populations?,role
867,Evaluate the sustainability of electric vehicle battery production.,cot
868,How does the built environment influence rates of physical activity in urban populations?,cot
869,Describe the fundamentals of machine learning model evaluation.,role
870,How do science museums influence public understanding of controversial technologies?,role
871,What are the most promising approaches to supporting interdisciplinary STEM education at the university level?,cot
872,What are efficient ways to learn coding?,cot
873,Analyze the impact of arts education on student development.,role
874,What measures can governments take to accelerate the adoption of electric vehicles while ensuring grid stability and affordability?,cot
875,Design a mentorship structure to support new small business owners.,cot
876,How does lack of internet access affect disaster preparedness in rural regions?,cot
877,Explain the principles of design thinking.,role
878,Explain the scientific method.,role
879,What design strategies can make urban architecture more climate-resilient?,role
880,What is the most effective way for a national government to promote scientific literacy among its citizens?,cot
881,Describe the impact of social media on mental health.,role
882,How do budget constraints influence curriculum design in public schools?,cot
883,Explain the concept of supply and demand in economics.,role
884,Discuss the role of fungi in ecosystem stability.,role
885,Analyze the cultural importance of indigenous languages.,role
886,What strategies can urban planners use to ensure affordable and inclusive housing in rapidly growing cities?,cot
887,What steps should a city take to ensure equitable access to green spaces for all residents?,cot
888,How can language policy promote multilingual education in diverse societies?,role
889,Design a digital archive system for endangered languages.,cot
890,How does gentrification affect long-term residents?,cot
891,How do feedback mechanisms shape online community behavior?,cot
892,How can urban design support mental health?,cot
893,What are the most effective methods for fostering intergenerational dialogue and collaboration in community development projects?,cot
894,Analyze the significance of the scientific method in research.,role
895,What techniques can writers use to build suspense in fiction?,role
896,Describe the role of pollinators in agriculture.,role
897,What narrative techniques are essential for building immersive world-building in speculative fiction?,role
898,Write a compelling personal statement for a college application.,cot
899,Write a short story about a time traveler influencing history.,role
900,What is dark matter and why does it matter in cosmology?,role
901,Build a framework for ethical AI deployment in healthcare.,cot
902,Explain the concept of game theory.,role
903,Write a short story about a time traveler in ancient civilizations.,role
904,What is the most effective way to design professional development programs that promote lifelong learning among educators?,cot
905,How can a university design a comprehensive mental health program for students and staff?,cot
906,Analyze the concept of social justice.,role
907,What are the most effective ways to teach the scientific method to middle school students and foster genuine inquiry skills?,cot
908,What is the most robust framework for analyzing ethical dilemmas in rapidly evolving technological fields?,cot
909,What are the climate justice dimensions of infrastructure investment in developing nations?,role
910,How do evolutionary principles apply to business and innovation?,role
911,How do workplace layouts influence productivity in collaborative teams?,cot
912,Explain the basics of satellite communications.,role
913,Explain the principles of conflict resolution.,role
914,Describe how nuclear medicine is used for diagnostics.,role
915,Explain the biological processes involved in aging.,role
916,What makes citizen science initiatives impactful?,cot
917,Discuss the role of biotechnology in agriculture.,role
918,Analyze the effects of automation on warehouse labor markets.,cot
919,How does sleep deprivation impact decision-making in high-stakes professions?,cot
920,Create a social media strategy for a nonprofit organization.,role
921,What processes enable restorative justice in post-conflict societies?,role
922,Analyze the impact of artificial intelligence on job markets.,role
923,Discuss the implications of artificial intelligence in healthcare.,role
924,How can a country improve food security through advances in agricultural technology and policy?,cot
925,Create a plan for transitioning into retirement.,cot
926,What international agreements and enforcement mechanisms are most effective for addressing illegal wildlife trafficking?,cot
927,How to support bilingual development in early childhood?,role
928,What contributes to digital burnout among remote workers?,cot
929,What are the most effective strategies for promoting interdisciplinary collaboration in climate change research?,cot
930,How can universities structure support systems to enhance the well-being and academic success of first-generation college students?,cot
931,How do microaggressions affect workplace morale and retention?,role
932,Develop a plan to learn photography fundamentals.,cot
933,Describe how CRISPR gene editing works and what diseases it could potentially cure.,role
934,Investigate the impact of globalization on local cultures.,role
935,What steps can schools take to support students’ social and emotional learning (SEL) alongside academic achievement?,cot
936,How do public monuments shape collective memory?,cot
937,How can zoning policies promote walkable communities?,cot
938,Analyze the impact of leadership styles on organizational culture.,role
939,Explain how the endocrine system regulates stress.,role
940,What are the drivers of youth disengagement from civic participation?,cot
941,Analyze the impact of economic inequality.,role
942,How can K–12 schools build resilience to cyberattacks and ensure the security of student data?,cot
943,How should a country develop a national artificial intelligence strategy that balances innovation with ethical responsibility?,cot
944,Draft a professional email requesting mentorship.,cot
945,Create a marketing plan for a new tech startup.,role
946,What influences participation in local elections?,cot
947,Analyze the relationship between food deserts and chronic disease.,cot
948,Explore the role of myth and archetype in shaping collective cultural identities.,role
949,How can national governments best support early-career researchers to ensure scientific innovation and retention of talent?,cot
950,What role does storytelling play in scientific communication?,cot
951,What are the tradeoffs in scaling telemedicine services nationwide?,cot
952,Analyze the effects of dietary choices on health.,role
953,Propose a youth mentorship network for climate activism.,cot
954,How do archival technologies shape historical narratives?,role
955,How do democratic societies safeguard against authoritarian backsliding?,role
956,How can virtual reality be used to treat phobias and PTSD?,role
957,What design principles promote accessibility in mobile apps?,cot
958,What is the most effective strategy for a country to manage a rapidly aging population?,cot
959,Discuss the implications of data privacy regulations.,role
960,What role does nutrition play in cognitive function?,role
961,What are the implications of biometric data collection in public spaces?,cot
962,How does fast fashion contribute to global water scarcity?,cot
963,Write a letter of recommendation for a former student.,cot
964,How can a national curriculum be designed to prepare students for the demands of the future workforce?,cot
965,How can participatory budgeting strengthen democratic governance in local governments?,role
966,What are the best approaches for integrating climate resilience into national economic policy?,cot
967,Explain how photosynthesis functions and its global importance.,role
968,What are the core components of trauma-informed organizational leadership?,role
969,How can schools better support multilingual students?,cot
970,Explore the concept of resilience in psychology.,role
971,Explain the psychological benefits of spending time in nature.,role
972,What storytelling techniques are most effective in documentary filmmaking?,role
973,Plan a time-capped digital detox weekend.,cot
974,How does microplastic pollution affect marine ecosystems?,cot
975,How do scientific revolutions redefine the trajectory of human understanding?,role
976,Create a public relations strategy for a nonprofit organization.,role
977,Discuss the cultural significance of street art.,role
978,Explain the mechanics of the water cycle.,role
979,Analyze the effects of income inequality on society.,role
980,"What are the most effective ways for a university to promote diversity, equity, and inclusion on campus?",cot
981,Examine the influence of Greek philosophy on Western thought.,role
982,Design a system for crowdsourcing community improvement ideas.,cot
983,How can primary education systems cultivate scientific curiosity and inquiry skills from an early age?,cot
984,What contributes to the rising popularity of co-living spaces?,cot
985,What are the social consequences of long-term unemployment?,cot
986,What are methods for conflict‑resolution in community groups?,role
987,What are the long-term impacts of algorithmic content filtering on political discourse?,cot
988,What’s the best way to prepare for a technical interview?,cot
989,Explain the significance of the Renaissance period.,role
990,What philosophical debates surround the nature of consciousness in AI systems?,role
991,What is the most effective way to combat antimicrobial resistance at a global level?,cot
992,How can a government support the successful reintegration of formerly incarcerated individuals into society?,cot
993,Develop a sci‑fi plot featuring a rogue AI questioning its existence.,role
994,How can immersive simulations support professional training in high-risk industries?,role
995,What is the best way for a country to ensure food safety from farm to table?,cot
996,What are pros and cons of telemedicine in modern healthcare?,role
