id,user_prompt,better_prompt
1,Write a fable.,"Compose a modern fable that imparts a relevant contemporary moral. The fable must include: 1. Anthropomorphized Characters: The main characters should be animals or inanimate objects that exhibit human traits. 2. A Central Conflict: A clear problem or dilemma that the protagonist faces. 3. A Succinct Narrative: The story should be brief and focused, leading directly to its conclusion. 4. An Explicit Moral: The story must conclude with a clear, one-sentence moral that encapsulates its lesson. 5. A Timeless Quality: While modern, the theme and lesson should feel universal."
2,Explain a historical document.,"Illuminate the significance of a major historical document (e.g., the Magna Carta, the Declaration of Independence, the Universal Declaration of Human Rights). Your illumination must cover: 1. The Historical Context: Describe the specific circumstances and events that led to the document's creation. 2. The Core Principles: Summarize the 2-3 most important ideas or principles articulated in the document. 3. The Key Signatories: Identify the key individuals or groups involved in drafting and signing it. 4. The Immediate Impact: What were the immediate effects of the document on the society of its time? 5. The Enduring Legacy: How has the document influenced subsequent history, law, and political thought?"
3,Design a magical creature.,"Engineer the concept for a new magical creature. The design should be holistic, considering its biology and role in its world. 1. Physiology and Anatomy: Describe its physical form, what it eats, and any unique biological traits. 2. Magical Abilities: Detail its magical powers, including their source, limitations, and visual manifestation. 3. Behavioral Ecology: Explain its social structure, mating habits, and how it interacts with its environment and other species. 4. Relationship with Mortals: How is this creature perceived and interacted with by the people in its world? (e.g., as a pest, a companion, a source of magical ingredients). 5. A Notable Weakness: A specific vulnerability that creates interesting story possibilities."
4,Write a chapter for a textbook.,"Author a chapter for an introductory textbook on a subject of your choice. The chapter must be structured for educational clarity. 1. Chapter Title and Learning Objectives: A clear title and a list of 3-4 things a student will know or be able to do after reading. 2. Introduction: An engaging opening that introduces the topic and explains its relevance. 3. Sub-sections with Headings: The main content broken down into logical, clearly-headed sections. 4. Key Term Definitions: Important vocabulary should be bolded and clearly defined. 5. A Case Study or Example: A real-world case study or detailed example that illustrates the chapter's main concepts. 6. Chapter Summary: A bulleted list summarizing the key takeaways. 7. Review Questions: A set of 3-5 questions to test comprehension."
5,Give me a fictional diary entry.,"Pen a fictional diary entry from the perspective of a historical figure during a significant event. The entry must: 1. Capture the Voice: Emulate the language, tone, and known personality of the historical figure. 2. Reflect the Period: The details, concerns, and worldview expressed must be authentic to the time period. 3. Blend the Personal and the Historical: The entry should mix personal, everyday details with the character's unique perspective on the major historical events unfolding around them. 4. Express an Emotion: The entry should convey a strong sense of the character's emotional state (e.g., hope, fear, uncertainty)."
6,Analyze a piece of propaganda.,"Dissect a piece of historical propaganda (e.g., a poster, a film). The dissection must identify the techniques used to influence its audience. 1. The Source and Audience: Who created this piece and who was the intended audience? 2. The Core Message: What is the central idea or action the propaganda is trying to promote? 3. Propaganda Techniques: Identify and provide examples of at least three specific techniques being used (e.g., appeal to fear, bandwagon, name-calling, glittering generalities). 4. Symbolism and Imagery: Analyze the key symbols and visual elements and what they are meant to represent. 5. Intended Effect: What was the desired emotional and behavioral response from the audience?"
7,Create a fictional festival.,"Imagine a detailed cultural festival for a fictional society. The description should make the festival feel real and significant. 1. Name and Purpose: The name of the festival and the reason for its celebration (e.g., harvest, religious observance, historical commemoration). 2. Timing and Duration: When does it take place and how long does it last? 3. Key Events and Rituals: Describe the 3-4 main events, parades, or rituals that are central to the festival. 4. Associated Foods and Crafts: What special foods are eaten and what crafts or goods are sold during the festival? 5. The Climax: Describe the culminating event that ends the festival."
8,Write a scientific abstract.,"Synthesize a fictional scientific study into a formal abstract. The abstract must be concise (under 250 words) and follow the IMRaD structure. 1. Introduction: A brief statement of the research question and its importance. 2. Methods: A concise summary of the experimental methods used. 3. Results: A clear statement of the key findings, including quantitative data if applicable. 4. Discussion/Conclusion: A concluding sentence on the interpretation and implications of the findings."
9,Give me a fictional political system.,"Theorize a unique system of government for a fictional society. The system should be detailed and have inherent potential for conflict. 1. The Name of the System: (e.g., 'The Deliberative Technocracy'). 2. The Source of Legitimacy: Why do the people follow the government? (e.g., divine right, social contract, technological superiority). 3. The Process of Governance: How are decisions made and leaders selected? 4. The Rights of the Individual: What is the relationship between the state and the individual citizen? 5. The Inherent Instability: What is the core philosophical or practical weakness that threatens to destabilize this system?"
10,Write a travel guide entry.,"Author an entry for a travel guide about a specific landmark or attraction. The entry should be both informative and enticing. 1. The 'Why Go' Section: A compelling opening paragraph that explains why this attraction is a must-see. 2. History and Background: A brief, interesting history of the landmark. 3. What to See and Do: A bulleted list of the key highlights and activities available at the site. 4. Practical Information: A section with essential details like address, opening hours, ticket prices, and the best time to visit. 5. An 'Insider Tip': A piece of advice that would enhance a visitor's experience."
11,Analyze a character's decision.,"Isolate a single, critical decision made by a character in a well-known work of fiction. Perform an in-depth analysis of that decision. 1. The Decision: Clearly state the specific choice the character made. 2. The Motivations: Analyze the competing internal and external factors that influenced the character's decision. 3. The Immediate Consequences: Describe the immediate results of the character's action. 4. The Long-Term Ramifications: Explain how this single decision impacted the rest of the plot and the character's ultimate fate. 5. The Thematic Significance: How does this decision and its consequences reinforce one of the story's central themes?"
12,Create a magical school.,"Establish the concept for a school of magic. The concept should be unique and detailed. 1. School Name and Location. 2. The Founding Philosophy: What is the school's core belief about magic and its use? 3. The Houses or Factions: If the school is divided into groups, describe them and their values. 4. The Curriculum: What are the core subjects, and what is one unique or dangerous class that is offered? 5. A Famous Alumnus: Briefly describe a famous graduate and what they are known for. 6. A Dark Secret: What is a secret about the school's history or a forbidden area on its grounds?"
13,Write a 'how-to' guide for a soft skill.,"Develop a practical guide on how to develop a specific soft skill (e.g., 'active listening', 'giving constructive feedback', 'managing up'). The guide should be actionable. 1. Define the Skill: A clear, concise definition of the skill and why it is important. 2. The Common Barriers: Identify 2-3 common mistakes or mindsets that prevent people from being good at this skill. 3. The 3-Step Method: A simple, memorable, step-by-step process for practicing the skill. 4. Practice Scenarios: Provide 2-3 hypothetical scenarios where a person could practice this skill. 5. A Self-Assessment Checklist: A list of questions a person can ask themselves to gauge their improvement."
14,Give me a fictional historical era.,"Delineate a distinct historical era for a fictional world. 1. The Name of the Era: (e.g., 'The Age of Sundering', 'The Era of Silent Stars'). 2. The Defining Event: The major event that started this era. 3. Key Characteristics: A description of the era's dominant technology, culture, and political climate. 4. The End of the Era: The major event that brought this era to a close. 5. The Lasting Legacy: How is this era remembered by future generations in the world?"
15,Write a script for a podcast episode.,"Outline a script for a 15-minute solo-hosted podcast episode on a specific topic. The script should be structured for an engaging listening experience. 1. Intro Music Cue. 2. The Hook: A compelling opening statement or question that grabs the listener's attention. 3. The Main Topic Introduction: Briefly introduce the topic and what the episode will cover. 4. Segment 1: The first main point, with a clear transition. 5. Segment 2: The second main point, with a clear transition. 6. Segment 3: The third main point, with a clear transition. 7. The Summary: A quick recap of the key takeaways. 8. The Call to Action: What you want the listener to do next. 9. Outro Music Cue."
16,Analyze a business strategy.,"Evaluate the business strategy of a real-world company. The evaluation should be objective and based on established business frameworks. 1. The Core Strategy: Identify and articulate the company's primary competitive strategy (e.g., cost leadership, differentiation, niche focus). 2. The Value Chain: Analyze the key activities the company performs to create value and how they align with its core strategy. 3. The Competitive Advantage: What is the company's sustainable competitive advantage? Why is it difficult for competitors to replicate? 4. The Key Risks: Identify 2-3 major external or internal risks that threaten the company's strategy. 5. Future Outlook: Provide a concluding assessment of the strategy's long-term viability."
17,Create a fictional element.,"Invent a new, fictional element for a science fiction or fantasy world. 1. Element Name and Symbol. 2. Physical Properties: Its appearance, state at room temperature, density, etc. 3. Unique Property: The one extraordinary scientific or magical property that makes this element special. 4. The Source: Where is this element found and how is it harvested or created? 5. The Applications: What are its primary uses in the world's technology or magic?"
18,Write a mission debriefing scene.,"Script a scene in which a character is debriefed by their superior after a mission. The scene should be written in screenplay format. 1. The Setting: A location that establishes the power dynamic (e.g., a sterile office, a dimly lit backroom). 2. The Official Report: The character gives a concise, official account of the mission's outcome. 3. The Probing Question: The superior asks a question that reveals they know more than they are letting on. 4. The Revelation of a Secret: The dialogue should reveal that something happened on the mission that was not in the official report. 5. A New Order: The scene must end with the superior giving the character a new, unexpected order based on the secret revelation."
19,Give me a fictional ruin.,"Describe a significant ancient ruin in a fantasy or sci-fi world. The description should be evocative and full of story hooks. 1. The Name: What is the ruin called by locals and by archaeologists? 2. The Original Purpose: What was this place in its prime? (e.g., a fortress, a temple, a library). 3. The Cataclysm: What event led to its ruin? 4. The Defining Feature: The most striking or mysterious feature of the ruin that remains today. 5. The Lingering Presence: What danger, mystery, or guardian still haunts the ruin?"
20,Write a step-by-step guide to a negotiation.,"Formulate a step-by-step guide to successfully negotiating a specific scenario (e.g., 'buying a car', 'resolving a dispute with a neighbor'). 1. Step 1: The Preparation: A checklist of the research and planning to do before the negotiation begins. 2. Step 2: The Opening: How to make the first offer or statement to frame the negotiation in your favor. 3. Step 3: The Exchange: A guide to presenting your points, listening to the other party, and finding common ground. 4. Step 4: The 'BATNA': Explain the concept of the 'Best Alternative to a Negotiated Agreement' and how to use it. 5. Step 5: The Close: How to finalize the agreement and ensure all terms are clear."
21,Analyze a poem's structure.,"Dissect the structure of a poem and explain how its form contributes to its meaning. The dissection should examine: 1. The Form: Identify the poem's form (e.g., sonnet, villanelle, free verse). 2. The Stanza Structure: How are the stanzas organized? How do they break up the poem's ideas? 3. The Rhyme Scheme: Map out the rhyme scheme (if any) and analyze its effect. Does it create harmony or tension? 4. The Meter: Analyze the rhythm and meter of the lines. How does the rhythm affect the tone? 5. The Synthesis: Conclude by explaining how these structural choices work together to reinforce the poem's central theme and emotional impact."
22,Create a fictional organization.,"Profile a fictional non-governmental organization (NGO) or activist group. 1. The Name and Logo Concept. 2. The Mission Statement: A clear, passionate statement of the organization's primary goal. 3. The Methods: What are the primary tactics the organization uses to achieve its goals? (e.g., public protests, political lobbying, research and education). 4. The Founder: A brief story about the person who founded the organization and their motivation. 5. The Main Antagonist: The corporation, government, or ideology that the organization is primarily fighting against."
23,Write a product teardown.,"Execute a 'product teardown' of a popular app or website. The teardown should be a critical analysis of its user experience and design. 1. The Onboarding Experience: Analyze the process for a new user, from signup to the 'aha!' moment. 2. The Core Loop: Identify and analyze the primary action or loop that keeps users coming back. 3. A Key Feature Analysis: Choose one key feature and analyze its design, usability, and effectiveness. 4. The 'Genius' Moment: Highlight one particularly clever or well-designed element of the product. 5. The 'Missed Opportunity': Identify one area where you believe the product could be significantly improved."
24,Give me a fictional plant.,"Invent a fictional plant or fungus. The invention should be detailed and have potential for use in a story. 1. The Name: Common and scientific. 2. The Appearance and Habitat: A description of the plant and where it grows. 3. The Unique Property: The one key property that makes it useful or dangerous (e.g., medicinal, poisonous, hallucinogenic, sentient). 4. The Harvesting Process: How is the plant gathered, and is there any danger or difficulty involved? 5. The Role in the Economy: How has this plant influenced the local economy or trade?"
25,Write a training module.,"Outline a single training module for a corporate workshop on a specific topic (e.g., 'Time Management', 'Cybersecurity Awareness'). 1. Module Title. 2. Learning Objective: What is the one thing participants will be able to do after this module? 3. The 'Hook' (5 min): An opening story, statistic, or question to engage the participants. 4. The Core Concept (15 min): A clear explanation of the key model or framework for the topic. 5. The Interactive Activity (20 min): A group activity or case study that allows participants to apply the concept. 6. The Debrief and Takeaway (10 min): A discussion to solidify the learning and provide an actionable takeaway."
26,Analyze a historical turning point.,Isolate a single historical event and argue for its significance as a major 'turning point'. The argument must be structured persuasively. 1. The 'World Before': Describe the state of affairs *before* the event. 2. The Event: A concise summary of the event itself. 3. The 'World After': Detail the immediate and significant changes that occurred as a direct result of the event. 4. The Counterfactual: Briefly explore the counterfactual—what would have likely happened if this event had not occurred? 5. The Concluding Argument: A final statement that synthesizes the evidence to prove why this event was a critical hinge in history.
27,Create a fictional military unit.,"Detail a unique, elite military unit for a sci-fi or fantasy setting. 1. Unit Name and Motto. 2. The Specialization: What is the unit's specific area of expertise on the battlefield? (e.g., psionic warfare, anti-magic operations, zero-gravity combat). 3. The Signature Equipment: Describe a piece of technology or a weapon that is unique to this unit. 4. The Recruitment and Training: How are members selected and what does their training entail? 5. A Legendary Mission: Briefly recount the story of the unit's most famous or difficult mission."
28,Write a 'first look' review of a new technology.,"Pen a 'first look' review of a new, real-world technology, written for a tech blog. The review should be balanced and insightful. 1. The Promise: What is the new technology supposed to do, and what problem does it claim to solve? 2. The Design and First Impressions: A description of the physical design, build quality, and initial user experience. 3. The 'Wow' Factor: Describe the one feature or aspect that is most impressive or innovative. 4. The 'Question Mark': Identify the biggest unanswered question or potential drawback of the technology. 5. The Verdict for Now: A concluding statement on who should be excited about this technology and what its future potential might be."
29,Give me a fictional black market.,"Describe a fictional black market or underground economy. 1. The Name/Location: The name of the market and where it is located (e.g., a hidden bazaar, a dark web network). 2. The Primary Goods: What are the main illegal or rare goods and services traded here? 3. The Currency: What form of currency is used? 4. The 'Code': A description of the unwritten rules or etiquette that govern transactions in the market. 5. The Enforcer: The powerful individual or group that enforces the rules and maintains order."
30,Write a personal essay.,"Compose a short personal essay based on a single, specific memory. The essay must use the memory to explore a larger theme or insight. 1. The Narrative: Recount the specific memory with vivid sensory details. 2. The Reflection: The essay must contain the narrator's reflections on the memory from their present-day perspective. 3. The Universal Theme: Connect the personal story to a larger, universal human experience (e.g., loss, discovery, regret). 4. The 'So What?': The essay must answer the implicit question 'so what?', revealing the significance of the memory and the insight gained from it."
31,Analyze a company's financial statement.,"Propose a framework for a basic analysis of a public company's annual financial statement for a beginner investor. The framework should identify key metrics to look for. 1. The Income Statement: Look for consistent revenue growth and stable profit margins. 2. The Balance Sheet: Check for a healthy debt-to-equity ratio and sufficient cash on hand. 3. The Cash Flow Statement: Ensure the company is generating positive cash flow from operations. 4. The 'Red Flags': A list of 2-3 warning signs to look out for, such as declining revenue or rapidly increasing debt. 5. The Big Picture: A final question: Does the financial story told by these numbers align with the company's public narrative?"
32,Create a fictional exploration mission.,"Outline the plan for a fictional exploration mission into an unknown territory (e.g., a deep-space anomaly, a newly discovered continent). 1. The Mission Name and Objective: The official name and the primary scientific or strategic goal. 2. The Vessel/Vehicle: A description of the ship or vehicle being used for the exploration. 3. The Crew: A list of the key crew members and their specialized roles. 4. The Primary Obstacle: The single biggest known danger or challenge the mission is expected to face. 5. The Contingency Plan: What is the protocol if the mission encounters a catastrophic failure or a discovery that changes everything?"
33,Write a 'myth vs. fact' guide.,"Construct a 'Myth vs. Fact' guide on a common topic. The guide should be designed to debunk popular misconceptions. For 3-5 common myths on the topic, the structure for each entry should be: 1. The Myth: State the common misconception clearly. 2. The Fact: State the reality in a clear, direct sentence. 3. The Explanation: A brief paragraph that explains why the myth is incorrect, citing evidence or reasoning."
34,Give me a fictional holiday tradition.,"Invent a single, unique tradition for a fictional holiday. The tradition should be rich with symbolic meaning. 1. The Name of the Tradition. 2. The Action: A clear description of what people do during this tradition. 3. The Symbolism: An explanation of the deeper meaning behind the actions and any objects used. 4. The Origin: A short story of how the tradition began. 5. A Modern Twist: How has the tradition been adapted or changed in modern times?"
35,Write a creative biography.,"Recount the life of a historical figure in the style of a creative non-fiction piece, focusing on a single, defining period of their life. The biography must: 1. Have a Narrative Focus: Instead of a cradle-to-grave summary, focus on a specific challenge, relationship, or creation. 2. Use Sensory Details: Describe the sights, sounds, and feelings of the historical setting. 3. Incorporate Primary Sources: Weave in quotes from the person's letters or journals to reveal their inner thoughts. 4. Explore a Central Question: The narrative should be driven by a central question about the person's character or motivations."
36,Analyze a user interface element.,"Perform a deep-dive analysis of a single, common user interface element (e.g., the 'pull-to-refresh' gesture, the 'hamburger' menu, the 'like' button). 1. The Function: What does the element do? 2. The Usability: Analyze its ease of use, discoverability, and efficiency. 3. The History: Briefly describe the origin of this UI pattern and how it became a standard. 4. The Psychology: Why is this design effective from a user psychology perspective? 5. A Potential Improvement: Suggest one way this common element could be improved or an alternative that could be used."
37,Create a fictional university.,Profile a fictional university. The profile should give it a distinct character and academic focus. 1. University Name and Motto. 2. The Founding Story: A brief history of the university's founding. 3. The Academic Specialization: What is the one field of study the university is world-renowned for? 4. The Campus: A description of the university's architecture and campus environment. 5. A Famous Tradition: Describe a unique annual tradition that all students participate in. 6. A Campus Legend: Recount a popular ghost story or legend associated with the university.
38,Write a 'how to choose' guide.,"Develop a guide on 'how to choose' the right product from a category with many options (e.g., 'how to choose a laptop', 'how to choose a coffee maker'). The guide should be a decision-making framework. 1. Step 1: Define Your Needs: A series of questions to help the user identify their primary use case and priorities. 2. Step 2: Understand the Key Specs: A glossary that explains the 3-4 most important technical specifications or features for this product category in simple terms. 3. Step 3: Set Your Budget: Advice on how to set a realistic budget. 4. Step 4: The Final Checklist: A summary checklist of features to compare when looking at specific models."
39,Give me a fictional code of laws.,Codify a list of 5-7 key laws from a fictional society. The laws should reveal the society's values and priorities. Each law should include: 1. The Law itself: A formal statement of the rule. 2. The Rationale: The stated reason why the law exists. 3. The Punishment: The penalty for breaking the law. 4. The Unspoken Implication: What does this law reveal about the society's deepest fears or power structure?
40,Write a character's internal monologue.,"Compose a short internal monologue of a character in a high-stakes situation. The monologue should be a stream-of-consciousness that reveals their state of mind. It must include: 1. Sensory Details: What the character is seeing, hearing, and feeling physically. 2. Fragmented Thoughts: The thoughts should not be perfectly grammatical sentences but should reflect the rapid, often chaotic nature of internal thought under pressure. 3. A Core Conflict: The monologue should show the character wrestling with a difficult choice or a powerful fear. 4. A Decision: The monologue must end with the character making a clear decision, even if it's a reluctant one."
